{
  "version": "1.0.0",
  "effective_date": "2026-03-15",
  "distribution": {
    "operations": {
      "percentage": 40,
      "description": "Allocation to operational expenses with room for growth as the platform scales. Operations are prioritized to ensure sustainable infrastructure and team growth.",
      "subcategories": {
        "infrastructure": 40,
        "personnel": 35,
        "marketing": 10,
        "legal_compliance": 10,
        "other": 5
      }
    },
    "founder": {
      "percentage": 10,
      "description": "Allocation to founder for project creation, vision, and ongoing leadership"
    },
    "antman_civic_fund": {
      "percentage": 10,
      "description": "Allocation to the Antman Civic Fund, a for-profit allocator fully controlled by the founder or a founder-appointed steward. All receipts and disbursements, plus their purposes, are recorded on-ledger while the founder directs destinations.",
      "stewardship": "Founder or founder-appointed steward retains 100% control of the allocator",
      "ledger_recording": "All inflows/outflows and purposes are recorded on-ledger for transparency"
    },
    "research_and_development": {
      "percentage": 20,
      "description": "Allocation to R&D for cryptographic improvements and protocol enhancements. This budget is reviewed quarterly for need; allocation may be adjusted based on findings.",
      "budget_status": "reviewed quarterly",
      "focus_areas": [
        "Zero-knowledge proof optimization",
        "Advanced redaction protocols",
        "Scalability improvements",
        "Cross-chain interoperability",
        "Performance benchmarking and optimization"
      ]
    },
    "civic": {
      "percentage": 20,
      "description": "Allocation to civic initiatives, public good projects, and community engagement after dedicated allocations (operations, founder, Antman Civic Fund, R&D).",
      "initiatives": [
        "Open source protocol development",
        "Educational programs on government transparency",
        "Public records accessibility initiatives",
        "Civic tech community grants",
        "Public interest litigation support",
        "Democracy infrastructure projects",
        "Community-driven transparency tools",
        "Open data advocacy and access programs"
      ]
    }
  },
  "total_percentage": 100,
  "notes": "Operations are funded first (40%), followed by founder (10%) and the founder-directed but fully ledger-recorded Antman Civic Fund (10%). R&D receives 20% with quarterly review. The remaining 20% flows to civic initiatives. Antman Civic Fund inflows/outflows and purposes are fully recorded on-ledger; other allocations follow standard ledger budget recording for transparency.",
  "review_period": "quarterly"
}
